"[25 Advanced MAUI] - Cos'è il SecureStorage in MAUI?";"Un'API simile alle Preferences, ma i dati vengono criptati usando il portachiavi nativo del dispositivo (Keystore su Android, Keychain su iOS). <b>Da usare assolutamente</b> per salvare i JWT Token o dati finanziari sensibili."
"[26 Delegati ed Eventi] - Cos'è un Delegato (Delegate)?";"È un tipo che rappresenta in modo sicuro un puntatore a un metodo. Ti permette di passare un metodo come parametro ad un altro metodo.<br><br><pre style=""background:#282c34; color:#abb2bf; padding:10px; border-radius:5px; white-space:pre-wrap; word-wrap:break-word;""><code>public delegate void LogMotore(string msg);</code></pre>"
"[26 Delegati ed Eventi] - Cos'è 'Action<T>'?";"È un delegato predefinito da .NET che <b>non restituisce alcun valore (void)</b>. Può accettare da 0 a 16 parametri.<br><br><pre style=""background:#282c34; color:#abb2bf; padding:10px; border-radius:5px; white-space:pre-wrap; word-wrap:break-word;""><code>Action&lt;string&gt; stampaErrore = msg => Console.WriteLine(msg);</code></pre>"
"[26 Delegati ed Eventi] - Cos'è 'Func<T, TResult>'?";"È un delegato predefinito che <b>restituisce sempre un valore</b>. L'ultimo parametro specificato è sempre il tipo di ritorno.<br><br><pre style=""background:#282c34; color:#abb2bf; padding:10px; border-radius:5px; white-space:pre-wrap; word-wrap:break-word;""><code>Func&lt;decimal, decimal, decimal&gt; calcolaIva = (prezzo, iva) => prezzo * iva;</code></pre>"
"[26 Delegati ed Eventi] - Cos'è 'Predicate<T>'?";"Un delegato speciale (simile a Func) che prende un oggetto e restituisce <b>sempre un booleano (true/false)</b>. Usatissimo in LINQ o nel metodo <code>.FindAll()</code> delle Liste."
"[26 Delegati ed Eventi] - Qual è la differenza tra un Delegato e un 'event'?";"L'<code>event</code> è un livello di protezione applicato sopra un delegato. Impedisce alle classi esterne di richiamare l'evento (solo la classe che lo possiede può 'lanciarlo') o di azzerare la lista degli iscritti (usando = invece di +=)."
"[27 Testing xUnit e Moq] - Cos'è il TDD (Test-Driven Development)?";"Una metodologia di sviluppo divisa in 3 fasi (Red, Green, Refactor):<br>1. Scrivi prima un test che <b>fallisce</b>.<br>2. Scrivi il codice minimo indispensabile per farlo <b>passare</b>.<br>3. Ottimizzi (Refactoring) mantenendo il test verde."
"[27 Testing xUnit e Moq] - In xUnit, qual è la differenza tra [Fact] e [Theory]?";"<b>[Fact]</b> testa una singola condizione fissa, senza parametri in ingresso.<br><b>[Theory]</b> esegue lo stesso test multipli volte passandogli set di dati diversi tramite l'attributo <code>[InlineData]</code>."
"[27 Testing xUnit e Moq] - Esempio di un test parametrico in xUnit?";"Usi [Theory] e [InlineData].<br><br><pre style=""background:#282c34; color:#abb2bf; padding:10px; border-radius:5px; white-space:pre-wrap; word-wrap:break-word;""><code>[Theory]<br>[InlineData(2.0, ""Sgonfia"")]<br>[InlineData(2.5, ""OK"")]<br>public void ControlloGomme_Test(double bar, string expected) { ... }</code></pre>"
"[27 Testing xUnit e Moq] - Nella libreria Moq, a cosa serve '.Setup()'?";"Serve a istruire il finto oggetto (Mock) su come deve comportarsi. <br>Es: ""Se la logica ti chiede di leggere l'olio, tu restituisci sempre 100, senza guardare il DB vero"".<br><br><pre style=""background:#282c34; color:#abb2bf; padding:10px; border-radius:5px; white-space:pre-wrap; word-wrap:break-word;""><code>mockRepo.Setup(x => x.GetLivelloOlio()).Returns(100);</code></pre>"
"[27 Testing xUnit e Moq] - Nella libreria Moq, a cosa serve '.Verify()'?";"Serve a controllare (nell'Assert) che il tuo codice abbia <b>effettivamente richiamato</b> un certo metodo del Mock. Utile per verificare che il metodo di salvataggio sia stato invocato."
"[28 C# Avanzato] - Cos'è la Reflection?";"Una funzionalità avanzata che permette a un programma C# di ispezionare se stesso a runtime. Puoi leggere il nome delle classi, scoprire quali metodi hanno o instanziarle senza usare <code>new</code>."
"[28 C# Avanzato] - Cosa sono gli Attributi (Attributes)?";"Sono metadati (etichette) che aggiungi al codice (classi, proprietà, metodi) tra parentesi quadre. La Reflection o i framework li leggono per decidere cosa fare.<br><br><pre style=""background:#282c34; color:#abb2bf; padding:10px; border-radius:5px; white-space:pre-wrap; word-wrap:break-word;""><code>[Obsolete(""Usa il nuovo metodo V2"")]<br>public void TagliandoVecchio() { }</code></pre>"
"[28 C# Avanzato] - Quando usare 'yield return' invece di riempire una List<T>?";"Quando hai collezioni <b>enormi</b> (es. migliaia di log dal macchinario in officina). <code>yield return</code> genera e restituisce un solo elemento alla volta su richiesta (Deferred Execution), tenendo la memoria RAM quasi a zero."
"[28 C# Avanzato] - Cos'è 'Span<T>' in C#?";"Una struct super-ottimizzata per accedere a porzioni contigue di memoria (es. Array o Stringhe) <b>senza allocare nuovi oggetti nell'Heap</b>. Usatissimo per app ad altissime prestazioni per azzerare il lavoro del Garbage Collector."
"[28 C# Avanzato] - Cos'è il Property Pattern Matching (C# 8+)?";"Permette di fare switch valutando direttamente le proprietà interne di un oggetto in modo pulitissimo.<br><br><pre style=""background:#282c34; color:#abb2bf; padding:10px; border-radius:5px; white-space:pre-wrap; word-wrap:break-word;""><code>string via = moto switch {<br>  { Modello: ""XT1200Z"", Gomme: ""Tassellate"" } => ""Pratomollo"",<br>  { Modello: ""R1"" } => ""Pista"",<br>  _ => ""SS45""<br>};</code></pre>"
"[29 Pattern Architetturali 2] - Cos'è lo State Pattern?";"Permette a un oggetto di cambiare il proprio comportamento quando cambia il suo stato interno (es. le mappature Touring / Sport della moto: il metodo 'Accelera' fa cose diverse in base allo stato attivo)."
"[29 Pattern Architetturali 2] - Cos'è il Template Method Pattern?";"La classe padre definisce l'algoritmo generale (lo 'scheletro') in un metodo principale, ma lascia che siano le classi figlie a implementare (con override) i singoli passaggi specifici."
"[29 Pattern Architetturali 2] - Cos'è il pattern Chain of Responsibility?";"Passa una richiesta (es. un'autenticazione HTTP) lungo una 'catena' di gestori. Ogni gestore decide se elaborare la richiesta o passarla al gestore successivo."
"[29 Pattern Architetturali 2] - Differenza tra pattern Facade e Adapter?";"La <b>Facade</b> semplifica un sistema complesso creando una singola interfaccia pulita (come il cruscotto della moto che nasconde i sensori).<br>L'<b>Adapter</b> traduce l'interfaccia incompatibile di una classe in un'interfaccia che il cliente si aspetta (come un adattatore OBD2)."
"[30 Web API Pro] - Cos'è un Middleware in ASP.NET Core?";"Un pezzo di software (es. Gestione Errori, Autenticazione, CORS) assemblato nella 'Pipeline' dell'app. Gestisce la richiesta HTTP in entrata e la risposta in uscita (simile alla Chain of Responsibility)."
"[30 Web API Pro] - Cos'è il CORS (Cross-Origin Resource Sharing)?";"Un sistema di sicurezza dei browser che impedisce a un'app web ospitata su 'dominioA.com' di fare chiamate API verso 'dominioB.com', a meno che 'dominioB' non abbia esplicitamente autorizzato 'dominioA' tramite gli Header CORS."
"[30 SQL Avanzato] - Differenza tra le clausole WHERE e HAVING?";"<b>WHERE</b> filtra le singole righe <i>prima</i> di qualsiasi raggruppamento (GROUP BY).<br><b>HAVING</b> filtra i risultati <i>dopo</i> che i dati sono stati raggruppati (es. mostrami solo i mesi in cui le SpeseTotali > 1000)."
"[31 MAUI Pro] - In MAUI, a cosa serve 'WeakReferenceMessenger' (o l'ex MessagingCenter)?";"Permette la comunicazione (Publish/Subscribe) tra due ViewModel (o due pagine) che non si conoscono tra loro, mantenendoli totalmente disaccoppiati (es. La pagina 'Aggiungi Spesa' avvisa la 'Home' di aggiornare il totale)."
"[31 MAUI Pro] - Cosa sono i Custom Handlers in MAUI?";"L'architettura moderna (sostituisce i Custom Renderers di Xamarin) per mappare un controllo astratto (es. un Entry) alla sua vera controparte nativa (es. EditText su Android o UITextField su iOS). Permette di personalizzare i componenti nativi."
"[31 MAUI Pro] - Come fai ad assegnare colori diversi se il telefono è in Modalità Scura (Dark Mode) in XAML?";"Usando l'estensione di markup <code>AppThemeBinding</code>.<br><br><pre style=""background:#282c34; color:#abb2bf; padding:10px; border-radius:5px; white-space:pre-wrap; word-wrap:break-word;""><code>&lt;Label Text=""Totale""<br>  TextColor=""{AppThemeBinding Light=Black, Dark=White}"" /&gt;</code></pre>"
"[31 MAUI Pro] - Come puoi leggere la risoluzione/dimensione dello schermo del telefono in MAUI?";"Tramite la classe statica DeviceDisplay.<br><br><pre style=""background:#282c34; color:#abb2bf; padding:10px; border-radius:5px; white-space:pre-wrap; word-wrap:break-word;""><code>var width = DeviceDisplay.MainDisplayInfo.Width;</code></pre>"
"[31 OOP] - Cos'è l'Inversion of Control (IoC) e qual è la differenza con la Dependency Injection (DI)?";"L'<b>IoC</b> è il Principio filosofico: togliere a una classe il controllo sulla creazione degli oggetti di cui ha bisogno.<br>La <b>DI</b> (Dependency Injection) è la tecnica pratica (il Design Pattern) usata per implementare l'IoC nel codice (passando le interfacce nei costruttori)."
"[31 EF Core] - Differenza tra approccio Code-First e Database-First?";"<b>Code-First</b>: Scrivi prima le classi in C# e usi le Migrations per far creare al framework le tabelle SQL vuote.<br><b>Database-First</b>: Hai già un DB SQL bello e fatto e usi un comando (Scaffold) per generare in automatico le classi C#."